{
  "$schema": "https://json-schema.org/draft/2020-12/schema",
  "$id": "https://vecells.local/contracts/313_alternative_offer_session.schema.json",
  "title": "AlternativeOfferSession",
  "description": "Open-choice offer session for one hub case. Preserves offer set provenance, current truth tuple, and same-shell continuity while keeping callback fallback separate from ranked rows.",
  "type": "object",
  "additionalProperties": false,
  "properties": {
    "alternativeOfferSessionId": {
      "type": "string",
      "minLength": 1,
      "description": "Stable identifier for the offer session."
    },
    "hubCoordinationCaseId": {
      "type": "string",
      "minLength": 1,
      "description": "Owning hub coordination case."
    },
    "candidateSnapshotRef": {
      "type": "string",
      "minLength": 1,
      "description": "Current NetworkCandidateSnapshot used to build the offer set."
    },
    "offerSetHash": {
      "type": "string",
      "minLength": 1,
      "description": "Stable hash of the ranked offer set shown to the patient or coordinator."
    },
    "truthTupleHash": {
      "type": "string",
      "minLength": 1,
      "description": "Current truth tuple hash that governs live selection and commit."
    },
    "policyTupleHash": {
      "type": "string",
      "minLength": 1,
      "description": "Policy tuple hash inherited from 312."
    },
    "visibilityEnvelopeVersionRef": {
      "type": "string",
      "minLength": 1,
      "description": "Visibility envelope version that governed offer disclosure."
    },
    "offerState": {
      "type": "string",
      "enum": [
        "live",
        "selected",
        "callback_selected",
        "expired",
        "superseded",
        "closed"
      ],
      "description": "Current offer-session posture. Superseded or expired sessions remain auditable only."
    },
    "callbackFallbackCardRef": {
      "type": [
        "string",
        "null"
      ],
      "minLength": 0,
      "description": "Separate callback fallback card associated with the offer set."
    },
    "selectedOfferEntryRef": {
      "type": [
        "string",
        "null"
      ],
      "minLength": 0,
      "description": "Currently selected ranked offer entry."
    },
    "selectedFallbackPath": {
      "type": [
        "string",
        "null"
      ],
      "minLength": 0,
      "description": "Selected fallback path when the separate fallback card wins."
    },
    "sameShellContinuationRef": {
      "type": "string",
      "minLength": 1,
      "description": "Shell continuity anchor that keeps offer review in the same route family."
    },
    "routeFamilyRef": {
      "type": "string",
      "minLength": 1,
      "description": "Owning route family for the offer session."
    },
    "patientChoiceDeadlineAt": {
      "type": "string",
      "format": "date-time",
      "description": "Deadline for live selection before the session expires."
    },
    "offerEntryRefs": {
      "type": "array",
      "minItems": 1,
      "items": {
        "type": "string",
        "minLength": 1
      },
      "description": "Ranked offer entry identifiers shown in the current session."
    },
    "provenanceMode": {
      "type": "string",
      "enum": [
        "live_current",
        "read_only_provenance"
      ],
      "description": "Whether the session is still live or has become read-only provenance after supersession."
    },
    "supersededBySessionRef": {
      "type": [
        "string",
        "null"
      ],
      "minLength": 0,
      "description": "Later session that superseded this one."
    },
    "sourceRefs": {
      "type": "array",
      "minItems": 1,
      "items": {
        "type": "string",
        "minLength": 1
      },
      "description": "Algorithm source refs carried into the contract pack."
    }
  },
  "required": [
    "alternativeOfferSessionId",
    "hubCoordinationCaseId",
    "candidateSnapshotRef",
    "offerSetHash",
    "truthTupleHash",
    "policyTupleHash",
    "visibilityEnvelopeVersionRef",
    "offerState",
    "sameShellContinuationRef",
    "routeFamilyRef",
    "patientChoiceDeadlineAt",
    "offerEntryRefs",
    "provenanceMode",
    "sourceRefs"
  ],
  "x-taskId": "seq_313",
  "x-contractVersion": "313.phase5.commit-visibility-freeze.v1",
  "x-sourceRefs": [
    "blueprint/phase-5-the-network-horizon.md#5E. Alternative offer generation, open choice, callback fallback, and patient continuity",
    "blueprint/phase-5-the-network-horizon.md#5F. Native hub booking commit, practice continuity, and cross-org messaging",
    "blueprint/phase-5-the-network-horizon.md#5H. Patient communications, network reminders, manage flows, and practice visibility",
    "blueprint/phase-cards.md#Card-6",
    "blueprint/phase-4-the-booking-engine.md#booking-truth-confirmation-and-practice-visibility-carry-forward",
    "blueprint/phase-4-the-booking-engine.md#manage-and-artifact-exposure-must-follow-current-truth",
    "blueprint/phase-0-the-foundation-protocol.md#replay-idempotency-and-external-effect-discipline",
    "blueprint/phase-0-the-foundation-protocol.md#adapter-receipts-checkpoints-and-external-settlement",
    "docs/architecture/311_phase5_hub_case_and_acting_context_contract.md",
    "docs/architecture/312_phase5_policy_capacity_and_candidate_ranking_contract.md",
    "docs/api/312_phase5_candidate_snapshot_and_rank_contract.md"
  ]
}
