{
  "alternativeOfferSessionId": "offer_session_313_001",
  "hubCoordinationCaseId": "hub_case_313_001",
  "candidateSnapshotRef": "network_candidate_snapshot_312_001",
  "offerSetHash": "51f8b84fda27ab3118df02868706c223deb197084431a9abc270966631bbed10",
  "truthTupleHash": "fdc6e08e85922d8629a4e866f354ef9d6ce692cb98ff7c00ec745248a17ed16c",
  "policyTupleHash": "1a81720620c0c808d02c73a0a034bde3c079f6634742b405777b67664d97490d",
  "visibilityEnvelopeVersionRef": "visibility_envelope_313_v4",
  "offerState": "selected",
  "callbackFallbackCardRef": "fallback_card_313_001",
  "selectedOfferEntryRef": "offer_entry_313_001",
  "selectedFallbackPath": null,
  "sameShellContinuationRef": "same_shell_anchor_313_001",
  "routeFamilyRef": "patient_network_booking",
  "patientChoiceDeadlineAt": "2026-04-22T14:30:00Z",
  "offerEntryRefs": [
    "offer_entry_313_001",
    "offer_entry_313_002",
    "offer_entry_313_003",
    "offer_entry_313_004"
  ],
  "provenanceMode": "live_current",
  "supersededBySessionRef": null,
  "sourceRefs": [
    "blueprint/phase-5-the-network-horizon.md#5E. Alternative offer generation, open choice, callback fallback, and patient continuity",
    "blueprint/phase-5-the-network-horizon.md#5F. Native hub booking commit, practice continuity, and cross-org messaging",
    "blueprint/phase-5-the-network-horizon.md#5H. Patient communications, network reminders, manage flows, and practice visibility",
    "blueprint/phase-cards.md#Card-6",
    "blueprint/phase-4-the-booking-engine.md#booking-truth-confirmation-and-practice-visibility-carry-forward",
    "blueprint/phase-4-the-booking-engine.md#manage-and-artifact-exposure-must-follow-current-truth",
    "blueprint/phase-0-the-foundation-protocol.md#replay-idempotency-and-external-effect-discipline",
    "blueprint/phase-0-the-foundation-protocol.md#adapter-receipts-checkpoints-and-external-settlement",
    "docs/architecture/311_phase5_hub_case_and_acting_context_contract.md",
    "docs/architecture/312_phase5_policy_capacity_and_candidate_ranking_contract.md",
    "docs/api/312_phase5_candidate_snapshot_and_rank_contract.md"
  ]
}
